*** descriptor by USB View
*** HHK professional original

Device Descriptor:
bcdUSB:             0x0110
bDeviceClass:         0x00
bDeviceSubClass:      0x00
bDeviceProtocol:      0x00
bMaxPacketSize0:      0x08 (8)
idVendor:           0x0853
idProduct:          0x0100
bcdDevice:          0x0102
iManufacturer:        0x01
0x0409: "Topre Corporation"
iProduct:             0x02
0x0409: "HHKB Professional"
iSerialNumber:        0x00
bNumConfigurations:   0x01

ConnectionStatus: DeviceConnected
Current Config Value: 0x01
Device Bus Speed:     Full
Device Address:       0x04
Open Pipes:              1

Endpoint Descriptor:
bEndpointAddress:     0x81
Transfer Type:   Interrupt
wMaxPacketSize:     0x0008 (8)
bInterval:            0x0A

Configuration Descriptor:
wTotalLength:       0x0022
bNumInterfaces:       0x01
bConfigurationValue:  0x01
iConfiguration:       0x00
bmAttributes:         0x80 (Bus Powered )
MaxPower:             0x32 (100 Ma)

Interface Descriptor:
bInterfaceNumber:     0x00
bAlternateSetting:    0x00
bNumEndpoints:        0x01
bInterfaceClass:      0x03
bInterfaceSubClass:   0x01
bInterfaceProtocol:   0x01
iInterface:           0x00

HID Descriptor:
bcdHID:             0x0111
bCountryCode:         0x0F
bNumDescriptors:      0x01
bDescriptorType:      0x22
wDescriptorLength:  0x0041

Endpoint Descriptor:
bEndpointAddress:     0x81
Transfer Type:   Interrupt
wMaxPacketSize:     0x0008 (8)
bInterval:            0x0A

